Unnamed: 0,index,ID,duration,start_seg,end_seg,wav,wav_format,wav_opts,spk_id,spk_id_format,spk_id_opts,wrd,wrd_format,wrd_opts,char,char_format,char_opts
42,133485,JeffBezos_2003_297.61_304.04,6.43,297.61,304.04,./ressources/audio/TEDLIUM_release-3/legacy/train/sph/JeffBezos_2003.sph,sph,,JeffBezos_2003,string,,sometimes in tangled masses filling the mud holes and furnishing the only footing for our poor pack animals on the march,string,,s o m e t i m e s _ i n _ t a n g l e d _ m a s s e s _ f i l l i n g _ t h e _ m u d _ h o l e s _ a n d _ f u r n i s h i n g _ t h e _ o n l y _ f o o t i n g _ f o r _ o u r _ p o o r _ p a c k _ a n i m a l s _ o n _ t h e _ m a r c h,string,
53,133496,JeffBezos_2003_426.24_432.62,6.38,426.24,432.62,./ressources/audio/TEDLIUM_release-3/legacy/train/sph/JeffBezos_2003.sph,sph,,JeffBezos_2003,string,, because when you take out that last piece of gold and they did incredibly quickly  i mean  if you look at the one thousand eight hundred and forty nine gold rush,string,,_ b e c a u s e _ w h e n _ y o u _ t a k e _ o u t _ t h a t _ l a s t _ p i e c e _ o f _ g o l d _ a n d _ t h e y _ d i d _ i n c r e d i b l y _ q u i c k l y _ _ i _ m e a n _ _ i f _ y o u _ l o o k _ a t _ t h e _ o n e _ t h o u s a n d _ e i g h t _ h u n d r e d _ a n d _ f o r t y _ n i n e _ g o l d _ r u s h,string,
7,133450,JeffBezos_2003_50.76_54.61,3.85,50.76,54.61,./ressources/audio/TEDLIUM_release-3/legacy/train/sph/JeffBezos_2003.sph,sph,,JeffBezos_2003,string,, just went through with the internet is a gold rush,string,,_ j u s t _ w e n t _ t h r o u g h _ w i t h _ t h e _ i n t e r n e t _ i s _ a _ g o l d _ r u s h,string,
51,133494,JeffBezos_2003_400.61_410.76,10.15,400.61,410.76,./ressources/audio/TEDLIUM_release-3/legacy/train/sph/JeffBezos_2003.sph,sph,,JeffBezos_2003,string,, here 's this guy there are many men in dawson at the present time who feel keenly disappointed they 've come thousands of miles on a perilous trip  risked life health ,string,,_ h e r e _ ' s _ t h i s _ g u y _ t h e r e _ a r e _ m a n y _ m e n _ i n _ d a w s o n _ a t _ t h e _ p r e s e n t _ t i m e _ w h o _ f e e l _ k e e n l y _ d i s a p p o i n t e d _ t h e y _ ' v e _ c o m e _ t h o u s a n d s _ o f _ m i l e s _ o n _ a _ p e r i l o u s _ t r i p _ _ r i s k e d _ l i f e _ h e a l t h _,string,
17,133460,JeffBezos_2003_138.36_149.27,10.91,138.36,149.27,./ressources/audio/TEDLIUM_release-3/legacy/train/sph/JeffBezos_2003.sph,sph,,JeffBezos_2003,string,,on earth by not rushing to california and they start to decide they are these are community affairs by the way local communities on the east coast would get together and whole teams of,string,,o n _ e a r t h _ b y _ n o t _ r u s h i n g _ t o _ c a l i f o r n i a _ a n d _ t h e y _ s t a r t _ t o _ d e c i d e _ t h e y _ a r e _ t h e s e _ a r e _ c o m m u n i t y _ a f f a i r s _ b y _ t h e _ w a y _ l o c a l _ c o m m u n i t i e s _ o n _ t h e _ e a s t _ c o a s t _ w o u l d _ g e t _ t o g e t h e r _ a n d _ w h o l e _ t e a m s _ o f,string,
90,133533,JeffBezos_2003_691.42_693.86,2.44,691.42,693.86,./ressources/audio/TEDLIUM_release-3/legacy/train/sph/JeffBezos_2003.sph,sph,,JeffBezos_2003,string,,i thought that would really work,string,,i _ t h o u g h t _ t h a t _ w o u l d _ r e a l l y _ w o r k,string,
72,133515,JeffBezos_2003_568.88_571.23,2.35,568.88,571.23,./ressources/audio/TEDLIUM_release-3/legacy/train/sph/JeffBezos_2003.sph,sph,,JeffBezos_2003,string,,how could it grow at two thousand three hundred percent a year ,string,,h o w _ c o u l d _ i t _ g r o w _ a t _ t w o _ t h o u s a n d _ t h r e e _ h u n d r e d _ p e r c e n t _ a _ y e a r _,string,
112,133555,JeffBezos_2003_830.17_837.41,7.24,830.17,837.41,./ressources/audio/TEDLIUM_release-3/legacy/train/sph/JeffBezos_2003.sph,sph,,JeffBezos_2003,string,, but you know before i get too far into condemning our ancestors i thought i 'd show you this is my conference room ,string,,_ b u t _ y o u _ k n o w _ b e f o r e _ i _ g e t _ t o o _ f a r _ i n t o _ c o n d e m n i n g _ o u r _ a n c e s t o r s _ i _ t h o u g h t _ i _ ' d _ s h o w _ y o u _ t h i s _ i s _ m y _ c o n f e r e n c e _ r o o m _,string,
13,133456,JeffBezos_2003_100.27_104.37,4.1,100.27,104.37,./ressources/audio/TEDLIUM_release-3/legacy/train/sph/JeffBezos_2003.sph,sph,,JeffBezos_2003,string,,people would get very excited about this when they read these articles,string,,p e o p l e _ w o u l d _ g e t _ v e r y _ e x c i t e d _ a b o u t _ t h i s _ w h e n _ t h e y _ r e a d _ t h e s e _ a r t i c l e s,string,
