Unnamed: 0,index,ID,duration,start_seg,end_seg,wav,wav_format,wav_opts,spk_id,spk_id_format,spk_id_opts,wrd,wrd_format,wrd_opts,char,char_format,char_opts
64,129881,KarenBass_2012_527.94_529.67,1.73,527.94,529.67,./ressources/audio/TEDLIUM_release-3/legacy/train/sph/KarenBass_2012.sph,sph,,KarenBass_2012,string,,at twelve thousand feet,string,,a t _ t w e l v e _ t h o u s a n d _ f e e t,string,
40,129857,KarenBass_2012_289.06_298.84,9.78,289.06,298.84,./ressources/audio/TEDLIUM_release-3/legacy/train/sph/KarenBass_2012.sph,sph,,KarenBass_2012,string,,a new species of bat was discovered in the cloud forests of ecuador  and what was amazing about that discovery is that it also solved the mystery,string,,a _ n e w _ s p e c i e s _ o f _ b a t _ w a s _ d i s c o v e r e d _ i n _ t h e _ c l o u d _ f o r e s t s _ o f _ e c u a d o r _ _ a n d _ w h a t _ w a s _ a m a z i n g _ a b o u t _ t h a t _ d i s c o v e r y _ i s _ t h a t _ i t _ a l s o _ s o l v e d _ t h e _ m y s t e r y,string,
42,129859,KarenBass_2012_305.05_309.51,4.46,305.05,309.51,./ressources/audio/TEDLIUM_release-3/legacy/train/sph/KarenBass_2012.sph,sph,,KarenBass_2012,string,, hasn 't even aired yet so you 're the very first to see this see what you think,string,,_ h a s n _ ' t _ e v e n _ a i r e d _ y e t _ s o _ y o u _ ' r e _ t h e _ v e r y _ f i r s t _ t o _ s e e _ t h i s _ s e e _ w h a t _ y o u _ t h i n k,string,
22,129839,KarenBass_2012_154.78_160.61,5.83,154.78,160.61,./ressources/audio/TEDLIUM_release-3/legacy/train/sph/KarenBass_2012.sph,sph,,KarenBass_2012,string,, mothers must lead their cubs down to the coast  where the snow will already be melting ,string,,_ m o t h e r s _ m u s t _ l e a d _ t h e i r _ c u b s _ d o w n _ t o _ t h e _ c o a s t _ _ w h e r e _ t h e _ s n o w _ w i l l _ a l r e a d y _ b e _ m e l t i n g _,string,
48,129865,KarenBass_2012_406.46_410.7,4.24,406.46,410.7,./ressources/audio/TEDLIUM_release-3/legacy/train/sph/KarenBass_2012.sph,sph,,KarenBass_2012,string,,now people often ask me where 's your favorite place on the planet,string,,n o w _ p e o p l e _ o f t e n _ a s k _ m e _ w h e r e _ ' s _ y o u r _ f a v o r i t e _ p l a c e _ o n _ t h e _ p l a n e t,string,
45,129862,KarenBass_2012_372.06_375.17,3.11,372.06,375.17,./ressources/audio/TEDLIUM_release-3/legacy/train/sph/KarenBass_2012.sph,sph,,KarenBass_2012,string,, the longest relative to body length of any mammal,string,,_ t h e _ l o n g e s t _ r e l a t i v e _ t o _ b o d y _ l e n g t h _ o f _ a n y _ m a m m a l,string,
15,129832,KarenBass_2012_109.34_118.77,9.43,109.34,118.77,./ressources/audio/TEDLIUM_release-3/legacy/train/sph/KarenBass_2012.sph,sph,,KarenBass_2012,string,,what we did we went to alaska  which is where the grizzlies rely on really high  almost inaccessible mountain slopes for their denning ,string,,w h a t _ w e _ d i d _ w e _ w e n t _ t o _ a l a s k a _ _ w h i c h _ i s _ w h e r e _ t h e _ g r i z z l i e s _ r e l y _ o n _ r e a l l y _ h i g h _ _ a l m o s t _ i n a c c e s s i b l e _ m o u n t a i n _ s l o p e s _ f o r _ t h e i r _ d e n n i n g _,string,
4,129821,KarenBass_2012_30.98_38.86,7.88,30.98,38.86,./ressources/audio/TEDLIUM_release-3/legacy/train/sph/KarenBass_2012.sph,sph,,KarenBass_2012,string,,now imagine a little brit somewhere that wasn 't cold and damp like home what an amazing experience ,string,,n o w _ i m a g i n e _ a _ l i t t l e _ b r i t _ s o m e w h e r e _ t h a t _ w a s n _ ' t _ c o l d _ a n d _ d a m p _ l i k e _ h o m e _ w h a t _ a n _ a m a z i n g _ e x p e r i e n c e _,string,
52,129869,KarenBass_2012_428.76_429.76,1.0,428.76,429.76,./ressources/audio/TEDLIUM_release-3/legacy/train/sph/KarenBass_2012.sph,sph,,KarenBass_2012,string,,it 's the,string,,i t _ ' s _ t h e,string,
46,129863,KarenBass_2012_393.79_398.21,4.42,393.79,398.21,./ressources/audio/TEDLIUM_release-3/legacy/train/sph/KarenBass_2012.sph,sph,,KarenBass_2012,string,, we filmed it by cutting a tiny little hole in the base of the flower,string,,_ w e _ f i l m e d _ i t _ b y _ c u t t i n g _ a _ t i n y _ l i t t l e _ h o l e _ i n _ t h e _ b a s e _ o f _ t h e _ f l o w e r,string,
17,129834,KarenBass_2012_122.18_124.3,2.12,122.18,124.3,./ressources/audio/TEDLIUM_release-3/legacy/train/sph/KarenBass_2012.sph,sph,,KarenBass_2012,string,,is a shoot from the air,string,,i s _ a _ s h o o t _ f r o m _ t h e _ a i r,string,
31,129848,KarenBass_2012_241_242.55,1.55,241.0,242.55,./ressources/audio/TEDLIUM_release-3/legacy/train/sph/KarenBass_2012.sph,sph,,KarenBass_2012,string,,the first year,string,,t h e _ f i r s t _ y e a r,string,
16,129833,KarenBass_2012_119.03_122.22,3.19,119.03,122.22,./ressources/audio/TEDLIUM_release-3/legacy/train/sph/KarenBass_2012.sph,sph,,KarenBass_2012,string,,and the only way to film that,string,,a n d _ t h e _ o n l y _ w a y _ t o _ f i l m _ t h a t,string,
54,129871,KarenBass_2012_438.06_444.44,6.38,438.06,444.44,./ressources/audio/TEDLIUM_release-3/legacy/train/sph/KarenBass_2012.sph,sph,,KarenBass_2012,string,,but at fifteen thousand feet it 's tough it 's freezing cold and,string,,b u t _ a t _ f i f t e e n _ t h o u s a n d _ f e e t _ i t _ ' s _ t o u g h _ i t _ ' s _ f r e e z i n g _ c o l d _ a n d,string,
27,129844,KarenBass_2012_217.65_223.51,5.86,217.65,223.51,./ressources/audio/TEDLIUM_release-3/legacy/train/sph/KarenBass_2012.sph,sph,,KarenBass_2012,string,,that was filmed from a helicopter using a gyro stabilized camera ,string,,t h a t _ w a s _ f i l m e d _ f r o m _ a _ h e l i c o p t e r _ u s i n g _ a _ g y r o _ s t a b i l i z e d _ c a m e r a _,string,
24,129841,KarenBass_2012_175_199.29,24.29,175.0,199.29,./ressources/audio/TEDLIUM_release-3/legacy/train/sph/KarenBass_2012.sph,sph,,KarenBass_2012,string,,these ,string,,t h e s e _,string,
21,129838,KarenBass_2012_152.85_154.25,1.4,152.85,154.25,./ressources/audio/TEDLIUM_release-3/legacy/train/sph/KarenBass_2012.sph,sph,,KarenBass_2012,string,,to find food,string,,t o _ f i n d _ f o o d,string,
1,129818,KarenBass_2012_16.12_23.27,7.15,16.12,23.27,./ressources/audio/TEDLIUM_release-3/legacy/train/sph/KarenBass_2012.sph,sph,,KarenBass_2012,string,,i 've been privileged to see so much of our beautiful earth and the people and creatures that live on it,string,,i _ ' v e _ b e e n _ p r i v i l e g e d _ t o _ s e e _ s o _ m u c h _ o f _ o u r _ b e a u t i f u l _ e a r t h _ a n d _ t h e _ p e o p l e _ a n d _ c r e a t u r e s _ t h a t _ l i v e _ o n _ i t,string,
50,129867,KarenBass_2012_415.28_419.97,4.69,415.28,419.97,./ressources/audio/TEDLIUM_release-3/legacy/train/sph/KarenBass_2012.sph,sph,,KarenBass_2012,string,,but some locations draw you back time and time again ,string,,b u t _ s o m e _ l o c a t i o n s _ d r a w _ y o u _ b a c k _ t i m e _ a n d _ t i m e _ a g a i n _,string,
2,129819,KarenBass_2012_22.93_29.97,7.04,22.93,29.97,./ressources/audio/TEDLIUM_release-3/legacy/train/sph/KarenBass_2012.sph,sph,,KarenBass_2012,string,,and my passion was inspired at the age of seven when my parents first took me to morocco at the edge of the sahara,string,,a n d _ m y _ p a s s i o n _ w a s _ i n s p i r e d _ a t _ t h e _ a g e _ o f _ s e v e n _ w h e n _ m y _ p a r e n t s _ f i r s t _ t o o k _ m e _ t o _ m o r o c c o _ a t _ t h e _ e d g e _ o f _ t h e _ s a h a r a,string,
57,129874,KarenBass_2012_454.93_461.88,6.95,454.93,461.88,./ressources/audio/TEDLIUM_release-3/legacy/train/sph/KarenBass_2012.sph,sph,,KarenBass_2012,string,, feels like a constant hangover  but the advantage of that wonderful thin atmosphere,string,,_ f e e l s _ l i k e _ a _ c o n s t a n t _ h a n g o v e r _ _ b u t _ t h e _ a d v a n t a g e _ o f _ t h a t _ w o n d e r f u l _ t h i n _ a t m o s p h e r e,string,
18,129835,KarenBass_2012_129.93_135.94,6.01,129.93,135.94,./ressources/audio/TEDLIUM_release-3/legacy/train/sph/KarenBass_2012.sph,sph,,KarenBass_2012,string,, and british columbia  thousands of bear families are emerging from their winter sleep,string,,_ a n d _ b r i t i s h _ c o l u m b i a _ _ t h o u s a n d s _ o f _ b e a r _ f a m i l i e s _ a r e _ e m e r g i n g _ f r o m _ t h e i r _ w i n t e r _ s l e e p,string,
43,129860,KarenBass_2012_330.41_331.8,1.39,330.41,331.8,./ressources/audio/TEDLIUM_release-3/legacy/train/sph/KarenBass_2012.sph,sph,,KarenBass_2012,string,, but how to reach it ,string,,_ b u t _ h o w _ t o _ r e a c h _ i t _,string,
58,129875,KarenBass_2012_461.88_468.45,6.57,461.88,468.45,./ressources/audio/TEDLIUM_release-3/legacy/train/sph/KarenBass_2012.sph,sph,,KarenBass_2012,string,,is that it enables you to see the stars in the heavens with amazing clarity have a look,string,,i s _ t h a t _ i t _ e n a b l e s _ y o u _ t o _ s e e _ t h e _ s t a r s _ i n _ t h e _ h e a v e n s _ w i t h _ a m a z i n g _ c l a r i t y _ h a v e _ a _ l o o k,string,
44,129861,KarenBass_2012_333.56_336.76,3.2,333.56,336.76,./ressources/audio/TEDLIUM_release-3/legacy/train/sph/KarenBass_2012.sph,sph,,KarenBass_2012,string,,necessity is the mother of evolution,string,,n e c e s s i t y _ i s _ t h e _ m o t h e r _ o f _ e v o l u t i o n,string,
59,129876,KarenBass_2012_482.84_487.17,4.33,482.84,487.17,./ressources/audio/TEDLIUM_release-3/legacy/train/sph/KarenBass_2012.sph,sph,,KarenBass_2012,string,,it 's called the altiplano or high plains,string,,i t _ ' s _ c a l l e d _ t h e _ a l t i p l a n o _ o r _ h i g h _ p l a i n s,string,
28,129845,KarenBass_2012_223.35_229.13,5.78,223.35,229.13,./ressources/audio/TEDLIUM_release-3/legacy/train/sph/KarenBass_2012.sph,sph,,KarenBass_2012,string,,and it 's a wonderful bit of gear  because it 's like having a flying tripod crane and dolly all rolled into one,string,,a n d _ i t _ ' s _ a _ w o n d e r f u l _ b i t _ o f _ g e a r _ _ b e c a u s e _ i t _ ' s _ l i k e _ h a v i n g _ a _ f l y i n g _ t r i p o d _ c r a n e _ a n d _ d o l l y _ a l l _ r o l l e d _ i n t o _ o n e,string,
8,129825,KarenBass_2012_54.96_65.11,10.15,54.96,65.11,./ressources/audio/TEDLIUM_release-3/legacy/train/sph/KarenBass_2012.sph,sph,,KarenBass_2012,string,, 'm really lucky  because i get to share that with millions of people worldwide  now the idea of having new perspectives of our planet,string,,_ ' m _ r e a l l y _ l u c k y _ _ b e c a u s e _ i _ g e t _ t o _ s h a r e _ t h a t _ w i t h _ m i l l i o n s _ o f _ p e o p l e _ w o r l d w i d e _ _ n o w _ t h e _ i d e a _ o f _ h a v i n g _ n e w _ p e r s p e c t i v e s _ o f _ o u r _ p l a n e t,string,
14,129831,KarenBass_2012_101.54_109.8,8.26,101.54,109.8,./ressources/audio/TEDLIUM_release-3/legacy/train/sph/KarenBass_2012.sph,sph,,KarenBass_2012,string,, but there 's a whole side to their lives that we hardly ever see and had never been filmed so,string,,_ b u t _ t h e r e _ ' s _ a _ w h o l e _ s i d e _ t o _ t h e i r _ l i v e s _ t h a t _ w e _ h a r d l y _ e v e r _ s e e _ a n d _ h a d _ n e v e r _ b e e n _ f i l m e d _ s o,string,
26,129843,KarenBass_2012_214.05_218.14,4.09,214.05,218.14,./ressources/audio/TEDLIUM_release-3/legacy/train/sph/KarenBass_2012.sph,sph,,KarenBass_2012,string,,i love that shot i always get goosebumps every time i see it,string,,i _ l o v e _ t h a t _ s h o t _ i _ a l w a y s _ g e t _ g o o s e b u m p s _ e v e r y _ t i m e _ i _ s e e _ i t,string,
12,129829,KarenBass_2012_87.52_89.97,2.45,87.52,89.97,./ressources/audio/TEDLIUM_release-3/legacy/train/sph/KarenBass_2012.sph,sph,,KarenBass_2012,string,,in nature 's great events,string,,i n _ n a t u r e _ ' s _ g r e a t _ e v e n t s,string,
11,129828,KarenBass_2012_79.9_87.17,7.27,79.9,87.17,./ressources/audio/TEDLIUM_release-3/legacy/train/sph/KarenBass_2012.sph,sph,,KarenBass_2012,string,, film it 's enabling us to get fresh new images and tell brand new stories,string,,_ f i l m _ i t _ ' s _ e n a b l i n g _ u s _ t o _ g e t _ f r e s h _ n e w _ i m a g e s _ a n d _ t e l l _ b r a n d _ n e w _ s t o r i e s,string,
60,129877,KarenBass_2012_488.24_494.05,5.81,488.24,494.05,./ressources/audio/TEDLIUM_release-3/legacy/train/sph/KarenBass_2012.sph,sph,,KarenBass_2012,string,,a place of extremes and extreme contrasts,string,,a _ p l a c e _ o f _ e x t r e m e s _ a n d _ e x t r e m e _ c o n t r a s t s,string,
36,129853,KarenBass_2012_267.77_275.22,7.45,267.77,275.22,./ressources/audio/TEDLIUM_release-3/legacy/train/sph/KarenBass_2012.sph,sph,,KarenBass_2012,string,,new technology is an amazing tool  but the other thing that really really excites me,string,,n e w _ t e c h n o l o g y _ i s _ a n _ a m a z i n g _ t o o l _ _ b u t _ t h e _ o t h e r _ t h i n g _ t h a t _ r e a l l y _ r e a l l y _ e x c i t e s _ m e,string,
41,129858,KarenBass_2012_298.44_303.92,5.48,298.44,303.92,./ressources/audio/TEDLIUM_release-3/legacy/train/sph/KarenBass_2012.sph,sph,,KarenBass_2012,string,,of what pollinated a unique flower it depends solely on the bat,string,,o f _ w h a t _ p o l l i n a t e d _ a _ u n i q u e _ f l o w e r _ i t _ d e p e n d s _ s o l e l y _ o n _ t h e _ b a t,string,
53,129870,KarenBass_2012_429.75_437.92,8.17,429.75,437.92,./ressources/audio/TEDLIUM_release-3/legacy/train/sph/KarenBass_2012.sph,sph,,KarenBass_2012,string,, altiplano in the high andes of south america  and it 's the most otherworldly place i know ,string,,_ a l t i p l a n o _ i n _ t h e _ h i g h _ a n d e s _ o f _ s o u t h _ a m e r i c a _ _ a n d _ i t _ ' s _ t h e _ m o s t _ o t h e r w o r l d l y _ p l a c e _ i _ k n o w _,string,
68,129885,KarenBass_2012_550_551.11,1.11,550.0,551.11,./ressources/audio/TEDLIUM_release-3/legacy/train/sph/KarenBass_2012.sph,sph,,KarenBass_2012,string,,i 'm really,string,,i _ ' m _ r e a l l y,string,
47,129864,KarenBass_2012_398.21_404.82,6.61,398.21,404.82,./ressources/audio/TEDLIUM_release-3/legacy/train/sph/KarenBass_2012.sph,sph,,KarenBass_2012,string,,and using a camera that could slow the action by forty times so imagine how quick that thing is in real life,string,,a n d _ u s i n g _ a _ c a m e r a _ t h a t _ c o u l d _ s l o w _ t h e _ a c t i o n _ b y _ f o r t y _ t i m e s _ s o _ i m a g i n e _ h o w _ q u i c k _ t h a t _ t h i n g _ i s _ i n _ r e a l _ l i f e,string,
9,129826,KarenBass_2012_64.74_71.38,6.64,64.74,71.38,./ressources/audio/TEDLIUM_release-3/legacy/train/sph/KarenBass_2012.sph,sph,,KarenBass_2012,string,,and actually being able to get that message out gets me out of bed every day with a spring in my step,string,,a n d _ a c t u a l l y _ b e i n g _ a b l e _ t o _ g e t _ t h a t _ m e s s a g e _ o u t _ g e t s _ m e _ o u t _ o f _ b e d _ e v e r y _ d a y _ w i t h _ a _ s p r i n g _ i n _ m y _ s t e p,string,
37,129854,KarenBass_2012_274.79_279.7,4.91,274.79,279.7,./ressources/audio/TEDLIUM_release-3/legacy/train/sph/KarenBass_2012.sph,sph,,KarenBass_2012,string,,is when new species are discovered  now when i heard about one animal,string,,i s _ w h e n _ n e w _ s p e c i e s _ a r e _ d i s c o v e r e d _ _ n o w _ w h e n _ i _ h e a r d _ a b o u t _ o n e _ a n i m a l,string,
25,129842,KarenBass_2012_203.46_211.33,7.87,203.46,211.33,./ressources/audio/TEDLIUM_release-3/legacy/train/sph/KarenBass_2012.sph,sph,,KarenBass_2012,string,, the fate of these bear families  and indeed that of all bears around the north pacific depends on the salmon kb,string,,_ t h e _ f a t e _ o f _ t h e s e _ b e a r _ f a m i l i e s _ _ a n d _ i n d e e d _ t h a t _ o f _ a l l _ b e a r s _ a r o u n d _ t h e _ n o r t h _ p a c i f i c _ d e p e n d s _ o n _ t h e _ s a l m o n _ k b,string,
67,129884,KarenBass_2012_546.22_548.4,2.18,546.22,548.4,./ressources/audio/TEDLIUM_release-3/legacy/train/sph/KarenBass_2012.sph,sph,,KarenBass_2012,string,,but just looking up with the naked eye,string,,b u t _ j u s t _ l o o k i n g _ u p _ w i t h _ t h e _ n a k e d _ e y e,string,
65,129882,KarenBass_2012_529.84_533.33,3.49,529.84,533.33,./ressources/audio/TEDLIUM_release-3/legacy/train/sph/KarenBass_2012.sph,sph,,KarenBass_2012,string,, dry thin air makes for perfect stargazing ,string,,_ d r y _ t h i n _ a i r _ m a k e s _ f o r _ p e r f e c t _ s t a r g a z i n g _,string,
66,129883,KarenBass_2012_539.17_542.93,3.76,539.17,542.93,./ressources/audio/TEDLIUM_release-3/legacy/train/sph/KarenBass_2012.sph,sph,,KarenBass_2012,string,,some of the world 's astronomers have telescopes nearby,string,,s o m e _ o f _ t h e _ w o r l d _ ' s _ a s t r o n o m e r s _ h a v e _ t e l e s c o p e s _ n e a r b y,string,
56,129873,KarenBass_2012_452.79_454.97,2.18,452.79,454.97,./ressources/audio/TEDLIUM_release-3/legacy/train/sph/KarenBass_2012.sph,sph,,KarenBass_2012,string,,and that pounding head just,string,,a n d _ t h a t _ p o u n d i n g _ h e a d _ j u s t,string,
29,129846,KarenBass_2012_229.92_232.79,2.87,229.92,232.79,./ressources/audio/TEDLIUM_release-3/legacy/train/sph/KarenBass_2012.sph,sph,,KarenBass_2012,string,,but technology alone isn 't enough,string,,b u t _ t e c h n o l o g y _ a l o n e _ i s n _ ' t _ e n o u g h,string,
19,129836,KarenBass_2012_137.79_144.01,6.22,137.79,144.01,./ressources/audio/TEDLIUM_release-3/legacy/train/sph/KarenBass_2012.sph,sph,,KarenBass_2012,string,,there is nothing to eat up here  but the conditions were ideal for hibernation ,string,,t h e r e _ i s _ n o t h i n g _ t o _ e a t _ u p _ h e r e _ _ b u t _ t h e _ c o n d i t i o n s _ w e r e _ i d e a l _ f o r _ h i b e r n a t i o n _,string,
51,129868,KarenBass_2012_419.54_429.15,9.61,419.54,429.15,./ressources/audio/TEDLIUM_release-3/legacy/train/sph/KarenBass_2012.sph,sph,,KarenBass_2012,string,,and one remote location i first went there as a backpacker i 've been back several times for filming most recently for untamed americas,string,,a n d _ o n e _ r e m o t e _ l o c a t i o n _ i _ f i r s t _ w e n t _ t h e r e _ a s _ a _ b a c k p a c k e r _ i _ ' v e _ b e e n _ b a c k _ s e v e r a l _ t i m e s _ f o r _ f i l m i n g _ m o s t _ r e c e n t l y _ f o r _ u n t a m e d _ a m e r i c a s,string,
61,129878,KarenBass_2012_504.84_508.6,3.76,504.84,508.6,./ressources/audio/TEDLIUM_release-3/legacy/train/sph/KarenBass_2012.sph,sph,,KarenBass_2012,string,, mars than earth it seems just as hostile to life ,string,,_ m a r s _ t h a n _ e a r t h _ i t _ s e e m s _ j u s t _ a s _ h o s t i l e _ t o _ l i f e _,string,
35,129852,KarenBass_2012_265.34_267.78,2.44,265.34,267.78,./ressources/audio/TEDLIUM_release-3/legacy/train/sph/KarenBass_2012.sph,sph,,KarenBass_2012,string,,for a filmmaker,string,,f o r _ a _ f i l m m a k e r,string,
33,129850,KarenBass_2012_251.21_257.22,6.01,251.21,257.22,./ressources/audio/TEDLIUM_release-3/legacy/train/sph/KarenBass_2012.sph,sph,,KarenBass_2012,string,, and we hung around with a helicopter for two whole weeks and eventually we got lucky,string,,_ a n d _ w e _ h u n g _ a r o u n d _ w i t h _ a _ h e l i c o p t e r _ f o r _ t w o _ w h o l e _ w e e k s _ a n d _ e v e n t u a l l y _ w e _ g o t _ l u c k y,string,
69,129886,KarenBass_2012_575_600.14,25.14,575.0,600.14,./ressources/audio/TEDLIUM_release-3/legacy/train/sph/KarenBass_2012.sph,sph,,KarenBass_2012,string,,the,string,,t h e,string,
10,129827,KarenBass_2012_71.46_79.97,8.51,71.46,79.97,./ressources/audio/TEDLIUM_release-3/legacy/train/sph/KarenBass_2012.sph,sph,,KarenBass_2012,string,,you might think that it 's quite hard to find new stories and new subjects  but new technology is changing the way we can,string,,y o u _ m i g h t _ t h i n k _ t h a t _ i t _ ' s _ q u i t e _ h a r d _ t o _ f i n d _ n e w _ s t o r i e s _ a n d _ n e w _ s u b j e c t s _ _ b u t _ n e w _ t e c h n o l o g y _ i s _ c h a n g i n g _ t h e _ w a y _ w e _ c a n,string,
6,129823,KarenBass_2012_41.45_49.47,8.02,41.45,49.47,./ressources/audio/TEDLIUM_release-3/legacy/train/sph/KarenBass_2012.sph,sph,,KarenBass_2012,string,,so as a filmmaker  i 've been from one end of the earth to the other trying to get the perfect shot,string,,s o _ a s _ a _ f i l m m a k e r _ _ i _ ' v e _ b e e n _ f r o m _ o n e _ e n d _ o f _ t h e _ e a r t h _ t o _ t h e _ o t h e r _ t r y i n g _ t o _ g e t _ t h e _ p e r f e c t _ s h o t,string,
55,129872,KarenBass_2012_443.99_452.59,8.6,443.99,452.59,./ressources/audio/TEDLIUM_release-3/legacy/train/sph/KarenBass_2012.sph,sph,,KarenBass_2012,string,,that thin air really gets you  sometimes it 's hard to breathe especially carrying all the heavy filming equipment ,string,,t h a t _ t h i n _ a i r _ r e a l l y _ g e t s _ y o u _ _ s o m e t i m e s _ i t _ ' s _ h a r d _ t o _ b r e a t h e _ e s p e c i a l l y _ c a r r y i n g _ a l l _ t h e _ h e a v y _ f i l m i n g _ e q u i p m e n t _,string,
3,129820,KarenBass_2012_29.93_31.17,1.24,29.93,31.17,./ressources/audio/TEDLIUM_release-3/legacy/train/sph/KarenBass_2012.sph,sph,,KarenBass_2012,string,, desert ,string,,_ d e s e r t _,string,
