,Unnamed: 0,index,ID,duration,start_seg,end_seg,wav,wav_format,wav_opts,spk_id,spk_id_format,spk_id_opts,wrd,wrd_format,wrd_opts,char,char_format,char_opts
0,84,65493,VanessaRuiz_2015P_518.46_525.35,6.89,518.46,525.35,/local_disk/idyie/tnguyen/TEDLIUM_release-3/legacy/train/sph/VanessaRuiz_2015P.sph,sph,,VanessaRuiz_2015P,string,,on the human skin danny makes it look as if a person 's skin has actually been removed,string,,o n _ t h e _ h u m a n _ s k i n _ d a n n y _ m a k e s _ i t _ l o o k _ a s _ i f _ a _ p e r s o n _ ' s _ s k i n _ h a s _ a c t u a l l y _ b e e n _ r e m o v e d,string,
1,45,65454,VanessaRuiz_2015P_281.79_289.12,7.33,281.79,289.12,/local_disk/idyie/tnguyen/TEDLIUM_release-3/legacy/train/sph/VanessaRuiz_2015P.sph,sph,,VanessaRuiz_2015P,string,,nothing can elicit an emotional response from joy to complete disgust more than the human body,string,,n o t h i n g _ c a n _ e l i c i t _ a n _ e m o t i o n a l _ r e s p o n s e _ f r o m _ j o y _ t o _ c o m p l e t e _ d i s g u s t _ m o r e _ t h a n _ t h e _ h u m a n _ b o d y,string,
5,106,65515,VanessaRuiz_2015P_657.39_663.07,5.68,657.39,663.07,/local_disk/idyie/tnguyen/TEDLIUM_release-3/legacy/train/sph/VanessaRuiz_2015P.sph,sph,,VanessaRuiz_2015P,string,,anatomical art has the power to reach far beyond the pages of a medical textbook,string,,a n a t o m i c a l _ a r t _ h a s _ t h e _ p o w e r _ t o _ r e a c h _ f a r _ b e y o n d _ t h e _ p a g e s _ o f _ a _ m e d i c a l _ t e x t b o o k,string,
8,88,65497,VanessaRuiz_2015P_545.41_547.85,2.44,545.41,547.85,/local_disk/idyie/tnguyen/TEDLIUM_release-3/legacy/train/sph/VanessaRuiz_2015P.sph,sph,,VanessaRuiz_2015P,string,,but he 's doing just fine,string,,b u t _ h e _ ' s _ d o i n g _ j u s t _ f i n e,string,
9,9,65418,VanessaRuiz_2015P_71.79_73.33,1.54,71.79,73.33,/local_disk/idyie/tnguyen/TEDLIUM_release-3/legacy/train/sph/VanessaRuiz_2015P.sph,sph,,VanessaRuiz_2015P,string,,without the help,string,,w i t h o u t _ t h e _ h e l p,string,
11,1,65410,VanessaRuiz_2015P_19.36_29.16,9.8,19.36,29.16,/local_disk/idyie/tnguyen/TEDLIUM_release-3/legacy/train/sph/VanessaRuiz_2015P.sph,sph,,VanessaRuiz_2015P,string,,through practices such as preventive medicine  patient empowerment and self monitoring down to now obsessing over every single step we take in a day,string,,t h r o u g h _ p r a c t i c e s _ s u c h _ a s _ p r e v e n t i v e _ m e d i c i n e _ _ p a t i e n t _ e m p o w e r m e n t _ a n d _ s e l f _ m o n i t o r i n g _ d o w n _ t o _ n o w _ o b s e s s i n g _ o v e r _ e v e r y _ s i n g l e _ s t e p _ w e _ t a k e _ i n _ a _ d a y,string,
12,51,65460,VanessaRuiz_2015P_314.62_317.12,2.5,314.62,317.12,/local_disk/idyie/tnguyen/TEDLIUM_release-3/legacy/train/sph/VanessaRuiz_2015P.sph,sph,,VanessaRuiz_2015P,string,,in a female sensuality,string,,i n _ a _ f e m a l e _ s e n s u a l i t y,string,
16,92,65501,VanessaRuiz_2015P_562.73_571.8,9.07,562.73,571.8,/local_disk/idyie/tnguyen/TEDLIUM_release-3/legacy/train/sph/VanessaRuiz_2015P.sph,sph,,VanessaRuiz_2015P,string,,his x rays show how culture can come to have an anatomy of its own and conversely how culture can become part of the anatomy of a person,string,,h i s _ x _ r a y s _ s h o w _ h o w _ c u l t u r e _ c a n _ c o m e _ t o _ h a v e _ a n _ a n a t o m y _ o f _ i t s _ o w n _ a n d _ c o n v e r s e l y _ h o w _ c u l t u r e _ c a n _ b e c o m e _ p a r t _ o f _ t h e _ a n a t o m y _ o f _ a _ p e r s o n,string,
17,108,65517,VanessaRuiz_2015P_668.28_670.07,1.79,668.28,670.07,/local_disk/idyie/tnguyen/TEDLIUM_release-3/legacy/train/sph/VanessaRuiz_2015P.sph,sph,,VanessaRuiz_2015P,string,,ultimately,string,,u l t i m a t e l y,string,
18,109,65518,VanessaRuiz_2015P_669.83_673.66,3.83,669.83,673.66,/local_disk/idyie/tnguyen/TEDLIUM_release-3/legacy/train/sph/VanessaRuiz_2015P.sph,sph,,VanessaRuiz_2015P,string,,connecting our innermost selves with our bodies,string,,c o n n e c t i n g _ o u r _ i n n e r m o s t _ s e l v e s _ w i t h _ o u r _ b o d i e s,string,
26,69,65478,VanessaRuiz_2015P_414.17_418.33,4.16,414.17,418.33,/local_disk/idyie/tnguyen/TEDLIUM_release-3/legacy/train/sph/VanessaRuiz_2015P.sph,sph,,VanessaRuiz_2015P,string,,by doing this michael downplays the common perception of anatomy,string,,b y _ d o i n g _ t h i s _ m i c h a e l _ d o w n p l a y s _ t h e _ c o m m o n _ p e r c e p t i o n _ o f _ a n a t o m y,string,
27,103,65512,VanessaRuiz_2015P_649.58_654.52,4.94,649.58,654.52,/local_disk/idyie/tnguyen/TEDLIUM_release-3/legacy/train/sph/VanessaRuiz_2015P.sph,sph,,VanessaRuiz_2015P,string,,to depict it in ways that we can relate whether it be through cartoons,string,,t o _ d e p i c t _ i t _ i n _ w a y s _ t h a t _ w e _ c a n _ r e l a t e _ w h e t h e r _ i t _ b e _ t h r o u g h _ c a r t o o n s,string,
30,85,65494,VanessaRuiz_2015P_530.98_534.17,3.19,530.98,534.17,/local_disk/idyie/tnguyen/TEDLIUM_release-3/legacy/train/sph/VanessaRuiz_2015P.sph,sph,,VanessaRuiz_2015P,string,, easily transitions into a medical illustration ,string,,_ e a s i l y _ t r a n s i t i o n s _ i n t o _ a _ m e d i c a l _ i l l u s t r a t i o n _,string,
31,71,65480,VanessaRuiz_2015P_423.26_429.49,6.23,423.26,429.49,/local_disk/idyie/tnguyen/TEDLIUM_release-3/legacy/train/sph/VanessaRuiz_2015P.sph,sph,,VanessaRuiz_2015P,string,,now this next concept might not make much sense but human anatomy is no longer limited to humans,string,,n o w _ t h i s _ n e x t _ c o n c e p t _ m i g h t _ n o t _ m a k e _ m u c h _ s e n s e _ b u t _ h u m a n _ a n a t o m y _ i s _ n o _ l o n g e r _ l i m i t e d _ t o _ h u m a n s,string,
37,13,65422,VanessaRuiz_2015P_92.5_100.05,7.55,92.5,100.05,/local_disk/idyie/tnguyen/TEDLIUM_release-3/legacy/train/sph/VanessaRuiz_2015P.sph,sph,,VanessaRuiz_2015P,string,,these beautiful illustrations are then shut back into the pages of a medical textbook or an app referenced only when,string,,t h e s e _ b e a u t i f u l _ i l l u s t r a t i o n s _ a r e _ t h e n _ s h u t _ b a c k _ i n t o _ t h e _ p a g e s _ o f _ a _ m e d i c a l _ t e x t b o o k _ o r _ a n _ a p p _ r e f e r e n c e d _ o n l y _ w h e n,string,
38,53,65462,VanessaRuiz_2015P_322.96_329.94,6.98,322.96,329.94,/local_disk/idyie/tnguyen/TEDLIUM_release-3/legacy/train/sph/VanessaRuiz_2015P.sph,sph,,VanessaRuiz_2015P,string,,thereby introducing a strong femininity that was previously lacking in the history of anatomical representation,string,,t h e r e b y _ i n t r o d u c i n g _ a _ s t r o n g _ f e m i n i n i t y _ t h a t _ w a s _ p r e v i o u s l y _ l a c k i n g _ i n _ t h e _ h i s t o r y _ o f _ a n a t o m i c a l _ r e p r e s e n t a t i o n,string,
40,26,65435,VanessaRuiz_2015P_180.74_184.86,4.12,180.74,184.86,/local_disk/idyie/tnguyen/TEDLIUM_release-3/legacy/train/sph/VanessaRuiz_2015P.sph,sph,,VanessaRuiz_2015P,string,,artists rendered dissected cadavers,string,,a r t i s t s _ r e n d e r e d _ d i s s e c t e d _ c a d a v e r s,string,
45,40,65449,VanessaRuiz_2015P_261.47_264.45,2.98,261.47,264.45,/local_disk/idyie/tnguyen/TEDLIUM_release-3/legacy/train/sph/VanessaRuiz_2015P.sph,sph,,VanessaRuiz_2015P,string,,is what we get to study from today ,string,,i s _ w h a t _ w e _ g e t _ t o _ s t u d y _ f r o m _ t o d a y _,string,
49,0,65409,VanessaRuiz_2015P_13.12_19.37,6.25,13.12,19.37,/local_disk/idyie/tnguyen/TEDLIUM_release-3/legacy/train/sph/VanessaRuiz_2015P.sph,sph,,VanessaRuiz_2015P,string,, as a lover of human anatomy i 'm so excited that we 're finally putting our bodies at the center of focus,string,,_ a s _ a _ l o v e r _ o f _ h u m a n _ a n a t o m y _ i _ ' m _ s o _ e x c i t e d _ t h a t _ w e _ ' r e _ f i n a l l y _ p u t t i n g _ o u r _ b o d i e s _ a t _ t h e _ c e n t e r _ o f _ f o c u s,string,
51,97,65506,VanessaRuiz_2015P_606.49_610.64,4.15,606.49,610.64,/local_disk/idyie/tnguyen/TEDLIUM_release-3/legacy/train/sph/VanessaRuiz_2015P.sph,sph,,VanessaRuiz_2015P,string,,street artists believe that art belongs to the public ,string,,s t r e e t _ a r t i s t s _ b e l i e v e _ t h a t _ a r t _ b e l o n g s _ t o _ t h e _ p u b l i c _,string,
52,100,65509,VanessaRuiz_2015P_627.38_634.8,7.42,627.38,634.8,/local_disk/idyie/tnguyen/TEDLIUM_release-3/legacy/train/sph/VanessaRuiz_2015P.sph,sph,,VanessaRuiz_2015P,string,, like i do that it elicits these responses at all is due to our intimate and often changing relationship with it,string,,_ l i k e _ i _ d o _ t h a t _ i t _ e l i c i t s _ t h e s e _ r e s p o n s e s _ a t _ a l l _ i s _ d u e _ t o _ o u r _ i n t i m a t e _ a n d _ o f t e n _ c h a n g i n g _ r e l a t i o n s h i p _ w i t h _ i t,string,
53,64,65473,VanessaRuiz_2015P_376.65_384.5,7.85,376.65,384.5,/local_disk/idyie/tnguyen/TEDLIUM_release-3/legacy/train/sph/VanessaRuiz_2015P.sph,sph,,VanessaRuiz_2015P,string,,and a concept that pushes the boundaries of anatomy as a way to know thyself which is why the work of michael reedy struck me,string,,a n d _ a _ c o n c e p t _ t h a t _ p u s h e s _ t h e _ b o u n d a r i e s _ o f _ a n a t o m y _ a s _ a _ w a y _ t o _ k n o w _ t h y s e l f _ w h i c h _ i s _ w h y _ t h e _ w o r k _ o f _ m i c h a e l _ r e e d y _ s t r u c k _ m e,string,
55,37,65446,VanessaRuiz_2015P_243.9_249.83,5.93,243.9,249.83,/local_disk/idyie/tnguyen/TEDLIUM_release-3/legacy/train/sph/VanessaRuiz_2015P.sph,sph,,VanessaRuiz_2015P,string,,they created a universal representation of anatomy something that was neither alive nor dead,string,,t h e y _ c r e a t e d _ a _ u n i v e r s a l _ r e p r e s e n t a t i o n _ o f _ a n a t o m y _ s o m e t h i n g _ t h a t _ w a s _ n e i t h e r _ a l i v e _ n o r _ d e a d,string,
59,99,65508,VanessaRuiz_2015P_616.48_624.93,8.45,616.48,624.93,/local_disk/idyie/tnguyen/TEDLIUM_release-3/legacy/train/sph/VanessaRuiz_2015P.sph,sph,,VanessaRuiz_2015P,string,,it forces you to look at it and confront your own perceptions about anatomy  whether you find it beautiful gross ,string,,i t _ f o r c e s _ y o u _ t o _ l o o k _ a t _ i t _ a n d _ c o n f r o n t _ y o u r _ o w n _ p e r c e p t i o n s _ a b o u t _ a n a t o m y _ _ w h e t h e r _ y o u _ f i n d _ i t _ b e a u t i f u l _ g r o s s _,string,
61,73,65482,VanessaRuiz_2015P_440.16_445.48,5.32,440.16,445.48,/local_disk/idyie/tnguyen/TEDLIUM_release-3/legacy/train/sph/VanessaRuiz_2015P.sph,sph,,VanessaRuiz_2015P,string,,one might think that this would bring a morbid edge to one 's innocent childhood characters ,string,,o n e _ m i g h t _ t h i n k _ t h a t _ t h i s _ w o u l d _ b r i n g _ a _ m o r b i d _ e d g e _ t o _ o n e _ ' s _ i n n o c e n t _ c h i l d h o o d _ c h a r a c t e r s _,string,
67,28,65437,VanessaRuiz_2015P_193.67_200.01,6.34,193.67,200.01,/local_disk/idyie/tnguyen/TEDLIUM_release-3/legacy/train/sph/VanessaRuiz_2015P.sph,sph,,VanessaRuiz_2015P,string,,they also showed them as very much dead unwillingly stripped of their skin,string,,t h e y _ a l s o _ s h o w e d _ t h e m _ a s _ v e r y _ m u c h _ d e a d _ u n w i l l i n g l y _ s t r i p p e d _ o f _ t h e i r _ s k i n,string,
75,83,65492,VanessaRuiz_2015P_514.71_518.71,4.0,514.71,518.71,/local_disk/idyie/tnguyen/TEDLIUM_release-3/legacy/train/sph/VanessaRuiz_2015P.sph,sph,,VanessaRuiz_2015P,string,,that lends itself very well to painting directly,string,,t h a t _ l e n d s _ i t s e l f _ v e r y _ w e l l _ t o _ p a i n t i n g _ d i r e c t l y,string,
76,7,65416,VanessaRuiz_2015P_59.43_62.95,3.52,59.43,62.95,/local_disk/idyie/tnguyen/TEDLIUM_release-3/legacy/train/sph/VanessaRuiz_2015P.sph,sph,,VanessaRuiz_2015P,string,,wow  good most of you are in medicine ,string,,w o w _ _ g o o d _ m o s t _ o f _ y o u _ a r e _ i n _ m e d i c i n e _,string,
80,14,65423,VanessaRuiz_2015P_101.3_107.61,6.31,101.3,107.61,/local_disk/idyie/tnguyen/TEDLIUM_release-3/legacy/train/sph/VanessaRuiz_2015P.sph,sph,,VanessaRuiz_2015P,string,, and for the public medical illustrations may only be encountered passively on the walls of a doctor 's office,string,,_ a n d _ f o r _ t h e _ p u b l i c _ m e d i c a l _ i l l u s t r a t i o n s _ m a y _ o n l y _ b e _ e n c o u n t e r e d _ p a s s i v e l y _ o n _ t h e _ w a l l s _ o f _ a _ d o c t o r _ ' s _ o f f i c e,string,
81,107,65516,VanessaRuiz_2015P_662.61_668.17,5.56,662.61,668.17,/local_disk/idyie/tnguyen/TEDLIUM_release-3/legacy/train/sph/VanessaRuiz_2015P.sph,sph,,VanessaRuiz_2015P,string,,to ignite an excitement in the public  and reinvigorate an enthusiasm in the medical world ,string,,t o _ i g n i t e _ a n _ e x c i t e m e n t _ i n _ t h e _ p u b l i c _ _ a n d _ r e i n v i g o r a t e _ a n _ e n t h u s i a s m _ i n _ t h e _ m e d i c a l _ w o r l d _,string,
84,33,65442,VanessaRuiz_2015P_226.29_228.61,2.32,226.29,228.61,/local_disk/idyie/tnguyen/TEDLIUM_release-3/legacy/train/sph/VanessaRuiz_2015P.sph,sph,,VanessaRuiz_2015P,string,,the introduction of color,string,,t h e _ i n t r o d u c t i o n _ o f _ c o l o r,string,
86,68,65477,VanessaRuiz_2015P_405.08_413.79,8.71,405.08,413.79,/local_disk/idyie/tnguyen/TEDLIUM_release-3/legacy/train/sph/VanessaRuiz_2015P.sph,sph,,VanessaRuiz_2015P,string,,on the mirrored figure  he renders the full anatomy and covers it in glitter  making it look like candy,string,,o n _ t h e _ m i r r o r e d _ f i g u r e _ _ h e _ r e n d e r s _ t h e _ f u l l _ a n a t o m y _ a n d _ c o v e r s _ i t _ i n _ g l i t t e r _ _ m a k i n g _ i t _ l o o k _ l i k e _ c a n d y,string,
