Unnamed: 0,index,ID,duration,start_seg,end_seg,wav,wav_format,wav_opts,spk_id,spk_id_format,spk_id_opts,wrd,wrd_format,wrd_opts,char,char_format,char_opts
77,197103,ChrisBurkard_2015_512.13_516.52,4.39,512.13,516.52,./ressources/audio/TEDLIUM_release-3/legacy/train/sph/ChrisBurkard_2015.sph,sph,,ChrisBurkard_2015,string,,because all of a sudden in that moment it was something i was forced to earn ,string,,b e c a u s e _ a l l _ o f _ a _ s u d d e n _ i n _ t h a t _ m o m e n t _ i t _ w a s _ s o m e t h i n g _ i _ w a s _ f o r c e d _ t o _ e a r n _,string,
29,197055,ChrisBurkard_2015_240.91_245.63,4.72,240.91,245.63,./ressources/audio/TEDLIUM_release-3/legacy/train/sph/ChrisBurkard_2015.sph,sph,,ChrisBurkard_2015,string,,because if there 's one thing i 've realized  it 's that any career,string,,b e c a u s e _ i f _ t h e r e _ ' s _ o n e _ t h i n g _ i _ ' v e _ r e a l i z e d _ _ i t _ ' s _ t h a t _ a n y _ c a r e e r,string,
78,197104,ChrisBurkard_2015_516.72_525.02,8.3,516.72,525.02,./ressources/audio/TEDLIUM_release-3/legacy/train/sph/ChrisBurkard_2015.sph,sph,,ChrisBurkard_2015,string,,and i realized all this shivering had actually taught me something in life there are no shortcuts,string,,a n d _ i _ r e a l i z e d _ a l l _ t h i s _ s h i v e r i n g _ h a d _ a c t u a l l y _ t a u g h t _ m e _ s o m e t h i n g _ i n _ l i f e _ t h e r e _ a r e _ n o _ s h o r t c u t s,string,
87,197113,ChrisBurkard_2015_557.96_564.54,6.58,557.96,564.54,./ressources/audio/TEDLIUM_release-3/legacy/train/sph/ChrisBurkard_2015.sph,sph,,ChrisBurkard_2015,string,,so i look back at this photograph  it 's easy to see frozen fingers and,string,,s o _ i _ l o o k _ b a c k _ a t _ t h i s _ p h o t o g r a p h _ _ i t _ ' s _ e a s y _ t o _ s e e _ f r o z e n _ f i n g e r s _ a n d,string,
6,197032,ChrisBurkard_2015_54.99_62.89,7.9,54.99,62.89,./ressources/audio/TEDLIUM_release-3/legacy/train/sph/ChrisBurkard_2015.sph,sph,,ChrisBurkard_2015,string,, even with swollen lips  sunken eyes and cheeks flushed red  i have found that this place right here,string,,_ e v e n _ w i t h _ s w o l l e n _ l i p s _ _ s u n k e n _ e y e s _ a n d _ c h e e k s _ f l u s h e d _ r e d _ _ i _ h a v e _ f o u n d _ t h a t _ t h i s _ p l a c e _ r i g h t _ h e r e,string,
48,197074,ChrisBurkard_2015_353.14_354.88,1.74,353.14,354.88,./ressources/audio/TEDLIUM_release-3/legacy/train/sph/ChrisBurkard_2015.sph,sph,,ChrisBurkard_2015,string,,and once we got there the,string,,a n d _ o n c e _ w e _ g o t _ t h e r e _ t h e,string,
57,197083,ChrisBurkard_2015_404.93_405.98,1.05,404.93,405.98,./ressources/audio/TEDLIUM_release-3/legacy/train/sph/ChrisBurkard_2015.sph,sph,,ChrisBurkard_2015,string,, place,string,,_ p l a c e,string,
13,197039,ChrisBurkard_2015_88.75_98.4,9.65,88.75,98.4,./ressources/audio/TEDLIUM_release-3/legacy/train/sph/ChrisBurkard_2015.sph,sph,,ChrisBurkard_2015,string,,now  before we get into the why would anyone ever want to surf in freezing cold water i would love to give you a little perspective,string,,n o w _ _ b e f o r e _ w e _ g e t _ i n t o _ t h e _ w h y _ w o u l d _ a n y o n e _ e v e r _ w a n t _ t o _ s u r f _ i n _ f r e e z i n g _ c o l d _ w a t e r _ i _ w o u l d _ l o v e _ t o _ g i v e _ y o u _ a _ l i t t l e _ p e r s p e c t i v e,string,
81,197107,ChrisBurkard_2015_532.21_536.42,4.21,532.21,536.42,./ressources/audio/TEDLIUM_release-3/legacy/train/sph/ChrisBurkard_2015.sph,sph,,ChrisBurkard_2015,string,,and that tiny bit of suffering that i did for my photography ,string,,a n d _ t h a t _ t i n y _ b i t _ o f _ s u f f e r i n g _ t h a t _ i _ d i d _ f o r _ m y _ p h o t o g r a p h y _,string,
46,197072,ChrisBurkard_2015_338.96_342.57,3.61,338.96,342.57,./ressources/audio/TEDLIUM_release-3/legacy/train/sph/ChrisBurkard_2015.sph,sph,,ChrisBurkard_2015,string,,and one of my favorite things about these places,string,,a n d _ o n e _ o f _ m y _ f a v o r i t e _ t h i n g s _ a b o u t _ t h e s e _ p l a c e s,string,
50,197076,ChrisBurkard_2015_364.65_367.99,3.34,364.65,367.99,./ressources/audio/TEDLIUM_release-3/legacy/train/sph/ChrisBurkard_2015.sph,sph,,ChrisBurkard_2015,string,,helicopters really scare me  by the way ,string,,h e l i c o p t e r s _ r e a l l y _ s c a r e _ m e _ _ b y _ t h e _ w a y _,string,
47,197073,ChrisBurkard_2015_342.17_353.14,10.97,342.17,353.14,./ressources/audio/TEDLIUM_release-3/legacy/train/sph/ChrisBurkard_2015.sph,sph,,ChrisBurkard_2015,string,,was simply the challenge and the creativity it took just to get there hours days weeks spent on google earth trying to pinpoint any remote stretch of beach or reef we could actually get to,string,,w a s _ s i m p l y _ t h e _ c h a l l e n g e _ a n d _ t h e _ c r e a t i v i t y _ i t _ t o o k _ j u s t _ t o _ g e t _ t h e r e _ h o u r s _ d a y s _ w e e k s _ s p e n t _ o n _ g o o g l e _ e a r t h _ t r y i n g _ t o _ p i n p o i n t _ a n y _ r e m o t e _ s t r e t c h _ o f _ b e a c h _ o r _ r e e f _ w e _ c o u l d _ a c t u a l l y _ g e t _ t o,string,
52,197078,ChrisBurkard_2015_374.01_380,5.99,374.01,380.0,./ressources/audio/TEDLIUM_release-3/legacy/train/sph/ChrisBurkard_2015.sph,sph,,ChrisBurkard_2015,string,,where we ended up watching helplessly from the water as bears ravaged our camp site they walked off with our food,string,,w h e r e _ w e _ e n d e d _ u p _ w a t c h i n g _ h e l p l e s s l y _ f r o m _ t h e _ w a t e r _ a s _ b e a r s _ r a v a g e d _ o u r _ c a m p _ s i t e _ t h e y _ w a l k e d _ o f f _ w i t h _ o u r _ f o o d,string,
5,197031,ChrisBurkard_2015_41.03_53.62,12.59,41.03,53.62,./ressources/audio/TEDLIUM_release-3/legacy/train/sph/ChrisBurkard_2015.sph,sph,,ChrisBurkard_2015,string,,a brisk minus ten with windchill  and i could literally feel the blood trying to leave my hands  feet and face and rush to protect my vital organs it was the coldest i 've ever been,string,,a _ b r i s k _ m i n u s _ t e n _ w i t h _ w i n d c h i l l _ _ a n d _ i _ c o u l d _ l i t e r a l l y _ f e e l _ t h e _ b l o o d _ t r y i n g _ t o _ l e a v e _ m y _ h a n d s _ _ f e e t _ a n d _ f a c e _ a n d _ r u s h _ t o _ p r o t e c t _ m y _ v i t a l _ o r g a n s _ i t _ w a s _ t h e _ c o l d e s t _ i _ ' v e _ e v e r _ b e e n,string,
68,197094,ChrisBurkard_2015_460.52_470.15,9.63,460.52,470.15,./ressources/audio/TEDLIUM_release-3/legacy/train/sph/ChrisBurkard_2015.sph,sph,,ChrisBurkard_2015,string,,of where i was i didn 't know if i was drifting out to sea or towards shore  and all i could really make out was the faint sound of seagulls,string,,o f _ w h e r e _ i _ w a s _ i _ d i d n _ ' t _ k n o w _ i f _ i _ w a s _ d r i f t i n g _ o u t _ t o _ s e a _ o r _ t o w a r d s _ s h o r e _ _ a n d _ a l l _ i _ c o u l d _ r e a l l y _ m a k e _ o u t _ w a s _ t h e _ f a i n t _ s o u n d _ o f _ s e a g u l l s,string,
70,197096,ChrisBurkard_2015_477.62_482.19,4.57,477.62,482.19,./ressources/audio/TEDLIUM_release-3/legacy/train/sph/ChrisBurkard_2015.sph,sph,,ChrisBurkard_2015,string,, was out there floating i started to get a little bit nervous,string,,_ w a s _ o u t _ t h e r e _ f l o a t i n g _ i _ s t a r t e d _ t o _ g e t _ a _ l i t t l e _ b i t _ n e r v o u s,string,
58,197084,ChrisBurkard_2015_405.73_414.72,8.99,405.73,414.72,./ressources/audio/TEDLIUM_release-3/legacy/train/sph/ChrisBurkard_2015.sph,sph,,ChrisBurkard_2015,string,,where some of the largest the most violent storms in the world send huge waves smashing into the coastline we were in this tiny remote fjord,string,,w h e r e _ s o m e _ o f _ t h e _ l a r g e s t _ t h e _ m o s t _ v i o l e n t _ s t o r m s _ i n _ t h e _ w o r l d _ s e n d _ h u g e _ w a v e s _ s m a s h i n g _ i n t o _ t h e _ c o a s t l i n e _ w e _ w e r e _ i n _ t h i s _ t i n y _ r e m o t e _ f j o r d,string,
25,197051,ChrisBurkard_2015_219.05_221.44,2.39,219.05,221.44,./ressources/audio/TEDLIUM_release-3/legacy/train/sph/ChrisBurkard_2015.sph,sph,,ChrisBurkard_2015,string,,for me to start feeling suffocated,string,,f o r _ m e _ t o _ s t a r t _ f e e l i n g _ s u f f o c a t e d,string,
67,197093,ChrisBurkard_2015_455.1_460.51,5.41,455.1,460.51,./ressources/audio/TEDLIUM_release-3/legacy/train/sph/ChrisBurkard_2015.sph,sph,,ChrisBurkard_2015,string,,quickly became a full on blizzard  and i started to lose perception,string,,q u i c k l y _ b e c a m e _ a _ f u l l _ o n _ b l i z z a r d _ _ a n d _ i _ s t a r t e d _ t o _ l o s e _ p e r c e p t i o n,string,
20,197046,ChrisBurkard_2015_189.5_194.19,4.69,189.5,194.19,./ressources/audio/TEDLIUM_release-3/legacy/train/sph/ChrisBurkard_2015.sph,sph,,ChrisBurkard_2015,string,,sweating it out shooting surfers in these exotic tourist destinations ,string,,s w e a t i n g _ i t _ o u t _ s h o o t i n g _ s u r f e r s _ i n _ t h e s e _ e x o t i c _ t o u r i s t _ d e s t i n a t i o n s _,string,
65,197091,ChrisBurkard_2015_441.17_448.69,7.52,441.17,448.69,./ressources/audio/TEDLIUM_release-3/legacy/train/sph/ChrisBurkard_2015.sph,sph,,ChrisBurkard_2015,string,,and although i couldn 't even feel my finger to push the trigger i knew i wasn 't getting out so i just did whatever i could i shook it off whatever but,string,,a n d _ a l t h o u g h _ i _ c o u l d n _ ' t _ e v e n _ f e e l _ m y _ f i n g e r _ t o _ p u s h _ t h e _ t r i g g e r _ i _ k n e w _ i _ w a s n _ ' t _ g e t t i n g _ o u t _ s o _ i _ j u s t _ d i d _ w h a t e v e r _ i _ c o u l d _ i _ s h o o k _ i t _ o f f _ w h a t e v e r _ b u t,string,
64,197090,ChrisBurkard_2015_432.81_441.17,8.36,432.81,441.17,./ressources/audio/TEDLIUM_release-3/legacy/train/sph/ChrisBurkard_2015.sph,sph,,ChrisBurkard_2015,string,,and i told myself there 's not a chance you 're getting out of the water you traveled all this way and this is exactly what you 've been waiting for freezing cold conditions with perfect waves,string,,a n d _ i _ t o l d _ m y s e l f _ t h e r e _ ' s _ n o t _ a _ c h a n c e _ y o u _ ' r e _ g e t t i n g _ o u t _ o f _ t h e _ w a t e r _ y o u _ t r a v e l e d _ a l l _ t h i s _ w a y _ a n d _ t h i s _ i s _ e x a c t l y _ w h a t _ y o u _ ' v e _ b e e n _ w a i t i n g _ f o r _ f r e e z i n g _ c o l d _ c o n d i t i o n s _ w i t h _ p e r f e c t _ w a v e s,string,
40,197066,ChrisBurkard_2015_298.67_304.12,5.45,298.67,304.12,./ressources/audio/TEDLIUM_release-3/legacy/train/sph/ChrisBurkard_2015.sph,sph,,ChrisBurkard_2015,string,,lineup and once we got there we were pushing aside these ice chunks trying to get into waves it was,string,,l i n e u p _ a n d _ o n c e _ w e _ g o t _ t h e r e _ w e _ w e r e _ p u s h i n g _ a s i d e _ t h e s e _ i c e _ c h u n k s _ t r y i n g _ t o _ g e t _ i n t o _ w a v e s _ i t _ w a s,string,
61,197087,ChrisBurkard_2015_422.27_427.14,4.87,422.27,427.14,./ressources/audio/TEDLIUM_release-3/legacy/train/sph/ChrisBurkard_2015.sph,sph,,ChrisBurkard_2015,string,,i was in the water taking pictures of surfers  and it started to snow,string,,i _ w a s _ i n _ t h e _ w a t e r _ t a k i n g _ p i c t u r e s _ o f _ s u r f e r s _ _ a n d _ i t _ s t a r t e d _ t o _ s n o w,string,
16,197042,ChrisBurkard_2015_169.6_171.68,2.08,169.6,171.68,./ressources/audio/TEDLIUM_release-3/legacy/train/sph/ChrisBurkard_2015.sph,sph,,ChrisBurkard_2015,string,, surf photographer right,string,,_ s u r f _ p h o t o g r a p h e r _ r i g h t,string,
41,197067,ChrisBurkard_2015_304.96_309.95,4.99,304.96,309.95,./ressources/audio/TEDLIUM_release-3/legacy/train/sph/ChrisBurkard_2015.sph,sph,,ChrisBurkard_2015,string,, experience one i 'll never forget  because amidst those harsh conditions,string,,_ e x p e r i e n c e _ o n e _ i _ ' l l _ n e v e r _ f o r g e t _ _ b e c a u s e _ a m i d s t _ t h o s e _ h a r s h _ c o n d i t i o n s,string,
42,197068,ChrisBurkard_2015_309.64_318.57,8.93,309.64,318.57,./ressources/audio/TEDLIUM_release-3/legacy/train/sph/ChrisBurkard_2015.sph,sph,,ChrisBurkard_2015,string,,i felt like i stumbled onto one of the last quiet places somewhere that i found a clarity and a connection with the world i knew,string,,i _ f e l t _ l i k e _ i _ s t u m b l e d _ o n t o _ o n e _ o f _ t h e _ l a s t _ q u i e t _ p l a c e s _ s o m e w h e r e _ t h a t _ i _ f o u n d _ a _ c l a r i t y _ a n d _ a _ c o n n e c t i o n _ w i t h _ t h e _ w o r l d _ i _ k n e w,string,
79,197105,ChrisBurkard_2015_527.59_530.9,3.31,527.59,530.9,./ressources/audio/TEDLIUM_release-3/legacy/train/sph/ChrisBurkard_2015.sph,sph,,ChrisBurkard_2015,string,, that is worth pursuing is going to require us to suffer,string,,_ t h a t _ i s _ w o r t h _ p u r s u i n g _ i s _ g o i n g _ t o _ r e q u i r e _ u s _ t o _ s u f f e r,string,
10,197036,ChrisBurkard_2015_77.58_79.64,2.06,77.58,79.64,./ressources/audio/TEDLIUM_release-3/legacy/train/sph/ChrisBurkard_2015.sph,sph,,ChrisBurkard_2015,string,,it brutally draws us in,string,,i t _ b r u t a l l y _ d r a w s _ u s _ i n,string,
7,197033,ChrisBurkard_2015_62.55_65.59,3.04,62.55,65.59,./ressources/audio/TEDLIUM_release-3/legacy/train/sph/ChrisBurkard_2015.sph,sph,,ChrisBurkard_2015,string,,is somewhere i can find great joy ,string,,i s _ s o m e w h e r e _ i _ c a n _ f i n d _ g r e a t _ j o y _,string,
4,197030,ChrisBurkard_2015_38.53_41.49,2.96,38.53,41.49,./ressources/audio/TEDLIUM_release-3/legacy/train/sph/ChrisBurkard_2015.sph,sph,,ChrisBurkard_2015,string,,right at freezing the air,string,,r i g h t _ a t _ f r e e z i n g _ t h e _ a i r,string,
85,197111,ChrisBurkard_2015_552.49_554.22,1.73,552.49,554.22,./ressources/audio/TEDLIUM_release-3/legacy/train/sph/ChrisBurkard_2015.sph,sph,,ChrisBurkard_2015,string,,was a sense of fulfillment,string,,w a s _ a _ s e n s e _ o f _ f u l f i l l m e n t,string,
0,197026,ChrisBurkard_2015_13.72_16.49,2.77,13.72,16.49,./ressources/audio/TEDLIUM_release-3/legacy/train/sph/ChrisBurkard_2015.sph,sph,,ChrisBurkard_2015,string,, so if i told you that this,string,,_ s o _ i f _ i _ t o l d _ y o u _ t h a t _ t h i s,string,
24,197050,ChrisBurkard_2015_211.89_219.05,7.16,211.89,219.05,./ressources/audio/TEDLIUM_release-3/legacy/train/sph/ChrisBurkard_2015.sph,sph,,ChrisBurkard_2015,string,,that to me were all the trappings of places heavily touristed in and out of the water  and it didn 't take long,string,,t h a t _ t o _ m e _ w e r e _ a l l _ t h e _ t r a p p i n g s _ o f _ p l a c e s _ h e a v i l y _ t o u r i s t e d _ i n _ a n d _ o u t _ o f _ t h e _ w a t e r _ _ a n d _ i t _ d i d n _ ' t _ t a k e _ l o n g,string,
36,197062,ChrisBurkard_2015_273.17_279.88,6.71,273.17,279.88,./ressources/audio/TEDLIUM_release-3/legacy/train/sph/ChrisBurkard_2015.sph,sph,,ChrisBurkard_2015,string,,that i felt like i found exactly what i was looking for i was blown away by the natural beauty of the landscape,string,,t h a t _ i _ f e l t _ l i k e _ i _ f o u n d _ e x a c t l y _ w h a t _ i _ w a s _ l o o k i n g _ f o r _ i _ w a s _ b l o w n _ a w a y _ b y _ t h e _ n a t u r a l _ b e a u t y _ o f _ t h e _ l a n d s c a p e,string,
31,197057,ChrisBurkard_2015_252.22_254.97,2.75,252.22,254.97,./ressources/audio/TEDLIUM_release-3/legacy/train/sph/ChrisBurkard_2015.sph,sph,,ChrisBurkard_2015,string,,so in my search to break up this monotony i realized,string,,s o _ i n _ m y _ s e a r c h _ t o _ b r e a k _ u p _ t h i s _ m o n o t o n y _ i _ r e a l i z e d,string,
89,197115,ChrisBurkard_2015_571.7_574.81,3.11,571.7,574.81,./ressources/audio/TEDLIUM_release-3/legacy/train/sph/ChrisBurkard_2015.sph,sph,,ChrisBurkard_2015,string,,is just joy  thank you so much,string,,i s _ j u s t _ j o y _ _ t h a n k _ y o u _ s o _ m u c h,string,
66,197092,ChrisBurkard_2015_448.32_454.97,6.65,448.32,454.97,./ressources/audio/TEDLIUM_release-3/legacy/train/sph/ChrisBurkard_2015.sph,sph,,ChrisBurkard_2015,string,,that was the point that i felt this wind gush through the valley and hit me and what started as this light snowfall,string,,t h a t _ w a s _ t h e _ p o i n t _ t h a t _ i _ f e l t _ t h i s _ w i n d _ g u s h _ t h r o u g h _ t h e _ v a l l e y _ a n d _ h i t _ m e _ a n d _ w h a t _ s t a r t e d _ a s _ t h i s _ l i g h t _ s n o w f a l l,string,
72,197098,ChrisBurkard_2015_490.88_493.69,2.81,490.88,493.69,./ressources/audio/TEDLIUM_release-3/legacy/train/sph/ChrisBurkard_2015.sph,sph,,ChrisBurkard_2015,string,,and i don 't know if it was delirium setting in,string,,a n d _ i _ d o n _ ' t _ k n o w _ i f _ i t _ w a s _ d e l i r i u m _ s e t t i n g _ i n,string,
44,197070,ChrisBurkard_2015_321.67_329.97,8.3,321.67,329.97,./ressources/audio/TEDLIUM_release-3/legacy/train/sph/ChrisBurkard_2015.sph,sph,,ChrisBurkard_2015,string,,i was hooked  i was hooked cold water was constantly on my mind and from that point on my career focused,string,,i _ w a s _ h o o k e d _ _ i _ w a s _ h o o k e d _ c o l d _ w a t e r _ w a s _ c o n s t a n t l y _ o n _ m y _ m i n d _ a n d _ f r o m _ t h a t _ p o i n t _ o n _ m y _ c a r e e r _ f o c u s e d,string,
37,197063,ChrisBurkard_2015_279.93_287.14,7.21,279.93,287.14,./ressources/audio/TEDLIUM_release-3/legacy/train/sph/ChrisBurkard_2015.sph,sph,,ChrisBurkard_2015,string,, most importantly i couldn 't believe we were finding perfect waves in such a remote and rugged part of the world,string,,_ m o s t _ i m p o r t a n t l y _ i _ c o u l d n _ ' t _ b e l i e v e _ w e _ w e r e _ f i n d i n g _ p e r f e c t _ w a v e s _ i n _ s u c h _ a _ r e m o t e _ a n d _ r u g g e d _ p a r t _ o f _ t h e _ w o r l d,string,
9,197035,ChrisBurkard_2015_71.31_77.86,6.55,71.31,77.86,./ressources/audio/TEDLIUM_release-3/legacy/train/sph/ChrisBurkard_2015.sph,sph,,ChrisBurkard_2015,string,,pain is a kind of shortcut to mindfulness  it makes us suddenly aware of everything in the environment,string,,p a i n _ i s _ a _ k i n d _ o f _ s h o r t c u t _ t o _ m i n d f u l n e s s _ _ i t _ m a k e s _ u s _ s u d d e n l y _ a w a r e _ o f _ e v e r y t h i n g _ i n _ t h e _ e n v i r o n m e n t,string,
74,197100,ChrisBurkard_2015_498.68_500.46,1.78,498.68,500.46,./ressources/audio/TEDLIUM_release-3/legacy/train/sph/ChrisBurkard_2015.sph,sph,,ChrisBurkard_2015,string,,the entire time,string,,t h e _ e n t i r e _ t i m e,string,
35,197061,ChrisBurkard_2015_269.66_273.33,3.67,269.66,273.33,./ressources/audio/TEDLIUM_release-3/legacy/train/sph/ChrisBurkard_2015.sph,sph,,ChrisBurkard_2015,string,,where i began to look  and it was my first trip to iceland,string,,w h e r e _ i _ b e g a n _ t o _ l o o k _ _ a n d _ i t _ w a s _ m y _ f i r s t _ t r i p _ t o _ i c e l a n d,string,
2,197028,ChrisBurkard_2015_25.67_32.85,7.18,25.67,32.85,./ressources/audio/TEDLIUM_release-3/legacy/train/sph/ChrisBurkard_2015.sph,sph,,ChrisBurkard_2015,string,, i shiver just a little bit i want to tell you a little bit about this photograph i was swimming around,string,,_ i _ s h i v e r _ j u s t _ a _ l i t t l e _ b i t _ i _ w a n t _ t o _ t e l l _ y o u _ a _ l i t t l e _ b i t _ a b o u t _ t h i s _ p h o t o g r a p h _ i _ w a s _ s w i m m i n g _ a r o u n d,string,
60,197086,ChrisBurkard_2015_416.33_422.22,5.89,416.33,422.22,./ressources/audio/TEDLIUM_release-3/legacy/train/sph/ChrisBurkard_2015.sph,sph,,ChrisBurkard_2015,string,,it had a greater population of sheep than people so help if we needed it was nowhere to be found,string,,i t _ h a d _ a _ g r e a t e r _ p o p u l a t i o n _ o f _ s h e e p _ t h a n _ p e o p l e _ s o _ h e l p _ i f _ w e _ n e e d e d _ i t _ w a s _ n o w h e r e _ t o _ b e _ f o u n d,string,
86,197112,ChrisBurkard_2015_554.9_556.89,1.99,554.9,556.89,./ressources/audio/TEDLIUM_release-3/legacy/train/sph/ChrisBurkard_2015.sph,sph,,ChrisBurkard_2015,string,, i had always been searching for,string,,_ i _ h a d _ a l w a y s _ b e e n _ s e a r c h i n g _ f o r,string,
51,197077,ChrisBurkard_2015_368.04_374.14,6.1,368.04,374.14,./ressources/audio/TEDLIUM_release-3/legacy/train/sph/ChrisBurkard_2015.sph,sph,,ChrisBurkard_2015,string,,there was this one particularly bumpy boat ride up the coast of vancouver island to this kind of remote surf spot,string,,t h e r e _ w a s _ t h i s _ o n e _ p a r t i c u l a r l y _ b u m p y _ b o a t _ r i d e _ u p _ t h e _ c o a s t _ o f _ v a n c o u v e r _ i s l a n d _ t o _ t h i s _ k i n d _ o f _ r e m o t e _ s u r f _ s p o t,string,
75,197101,ChrisBurkard_2015_501.71_504.88,3.17,501.71,504.88,./ressources/audio/TEDLIUM_release-3/legacy/train/sph/ChrisBurkard_2015.sph,sph,,ChrisBurkard_2015,string,,now it was this trip and,string,,n o w _ i t _ w a s _ t h i s _ t r i p _ a n d,string,
22,197048,ChrisBurkard_2015_201.28_204.85,3.57,201.28,204.85,./ressources/audio/TEDLIUM_release-3/legacy/train/sph/ChrisBurkard_2015.sph,sph,,ChrisBurkard_2015,string,,it seemed to be i set out seeking adventure,string,,i t _ s e e m e d _ t o _ b e _ i _ s e t _ o u t _ s e e k i n g _ a d v e n t u r e,string,
28,197054,ChrisBurkard_2015_236.62_240.77,4.15,236.62,240.77,./ressources/audio/TEDLIUM_release-3/legacy/train/sph/ChrisBurkard_2015.sph,sph,,ChrisBurkard_2015,string,,i began this sort of personal crusade against the mundane ,string,,i _ b e g a n _ t h i s _ s o r t _ o f _ p e r s o n a l _ c r u s a d e _ a g a i n s t _ t h e _ m u n d a n e _,string,
71,197097,ChrisBurkard_2015_482.42_490.59,8.17,482.42,490.59,./ressources/audio/TEDLIUM_release-3/legacy/train/sph/ChrisBurkard_2015.sph,sph,,ChrisBurkard_2015,string,,actually i was totally freaking out and i was borderline hypothermic and my friends eventually had to help me out of the water ,string,,a c t u a l l y _ i _ w a s _ t o t a l l y _ f r e a k i n g _ o u t _ a n d _ i _ w a s _ b o r d e r l i n e _ h y p o t h e r m i c _ a n d _ m y _ f r i e n d s _ e v e n t u a l l y _ h a d _ t o _ h e l p _ m e _ o u t _ o f _ t h e _ w a t e r _,string,
34,197060,ChrisBurkard_2015_265.94_269.86,3.92,265.94,269.86,./ressources/audio/TEDLIUM_release-3/legacy/train/sph/ChrisBurkard_2015.sph,sph,,ChrisBurkard_2015,string,,where the seas are notoriously rough and that 's exactly,string,,w h e r e _ t h e _ s e a s _ a r e _ n o t o r i o u s l y _ r o u g h _ a n d _ t h a t _ ' s _ e x a c t l y,string,
33,197059,ChrisBurkard_2015_256.96_266.34,9.38,256.96,266.34,./ressources/audio/TEDLIUM_release-3/legacy/train/sph/ChrisBurkard_2015.sph,sph,,ChrisBurkard_2015,string,,of the earth 's oceans that are warm and it 's really just that thin band around the equator so if i was going to find perfect waves  it was probably going to happen somewhere cold,string,,o f _ t h e _ e a r t h _ ' s _ o c e a n s _ t h a t _ a r e _ w a r m _ a n d _ i t _ ' s _ r e a l l y _ j u s t _ t h a t _ t h i n _ b a n d _ a r o u n d _ t h e _ e q u a t o r _ s o _ i f _ i _ w a s _ g o i n g _ t o _ f i n d _ p e r f e c t _ w a v e s _ _ i t _ w a s _ p r o b a b l y _ g o i n g _ t o _ h a p p e n _ s o m e w h e r e _ c o l d,string,
15,197041,ChrisBurkard_2015_110.69_124.57,13.88,110.69,124.57,./ressources/audio/TEDLIUM_release-3/legacy/train/sph/ChrisBurkard_2015.sph,sph,,ChrisBurkard_2015,string,, i,string,,_ i,string,
69,197095,ChrisBurkard_2015_469.66_474.99,5.33,469.66,474.99,./ressources/audio/TEDLIUM_release-3/legacy/train/sph/ChrisBurkard_2015.sph,sph,,ChrisBurkard_2015,string,,and crashing waves  now i knew this place had a reputation for,string,,a n d _ c r a s h i n g _ w a v e s _ _ n o w _ i _ k n e w _ t h i s _ p l a c e _ h a d _ a _ r e p u t a t i o n _ f o r,string,
45,197071,ChrisBurkard_2015_330.02_339.18,9.16,330.02,339.18,./ressources/audio/TEDLIUM_release-3/legacy/train/sph/ChrisBurkard_2015.sph,sph,,ChrisBurkard_2015,string,, on these types of harsh and unforgiving environments and it took me to places like russia norway alaska iceland chile the faroe islands and a lot of places in between ,string,,_ o n _ t h e s e _ t y p e s _ o f _ h a r s h _ a n d _ u n f o r g i v i n g _ e n v i r o n m e n t s _ a n d _ i t _ t o o k _ m e _ t o _ p l a c e s _ l i k e _ r u s s i a _ n o r w a y _ a l a s k a _ i c e l a n d _ c h i l e _ t h e _ f a r o e _ i s l a n d s _ a n d _ a _ l o t _ o f _ p l a c e s _ i n _ b e t w e e n _,string,
23,197049,ChrisBurkard_2015_204.93_212.38,7.45,204.93,212.38,./ressources/audio/TEDLIUM_release-3/legacy/train/sph/ChrisBurkard_2015.sph,sph,,ChrisBurkard_2015,string,, i was finding was only routine  it was things like wi fi tv fine dining and a constant cellular connection,string,,_ i _ w a s _ f i n d i n g _ w a s _ o n l y _ r o u t i n e _ _ i t _ w a s _ t h i n g s _ l i k e _ w i _ f i _ t v _ f i n e _ d i n i n g _ a n d _ a _ c o n s t a n t _ c e l l u l a r _ c o n n e c t i o n,string,
12,197038,ChrisBurkard_2015_82.35_88.73,6.38,82.35,88.73,./ressources/audio/TEDLIUM_release-3/legacy/train/sph/ChrisBurkard_2015.sph,sph,,ChrisBurkard_2015,string,,much like meditation if shivering is a form of meditation then i would consider myself a monk,string,,m u c h _ l i k e _ m e d i t a t i o n _ i f _ s h i v e r i n g _ i s _ a _ f o r m _ o f _ m e d i t a t i o n _ t h e n _ i _ w o u l d _ c o n s i d e r _ m y s e l f _ a _ m o n k,string,
82,197108,ChrisBurkard_2015_536.02_542.42,6.4,536.02,542.42,./ressources/audio/TEDLIUM_release-3/legacy/train/sph/ChrisBurkard_2015.sph,sph,,ChrisBurkard_2015,string,,it added a value to my work that was so much more meaningful to me than just trying to fill the pages of magazines,string,,i t _ a d d e d _ a _ v a l u e _ t o _ m y _ w o r k _ t h a t _ w a s _ s o _ m u c h _ m o r e _ m e a n i n g f u l _ t o _ m e _ t h a n _ j u s t _ t r y i n g _ t o _ f i l l _ t h e _ p a g e s _ o f _ m a g a z i n e s,string,
