Unnamed: 0,index,ID,duration,start_seg,end_seg,wav,wav_format,wav_opts,spk_id,spk_id_format,spk_id_opts,wrd,wrd_format,wrd_opts,char,char_format,char_opts
54,213231,EricTopol_2009P_379.93_390.26,10.33,379.93,390.26,./ressources/audio/TEDLIUM_release-3/legacy/train/sph/EricTopol_2009P.sph,sph,,EricTopol_2009P,string,, that 's where this is all starting  let me just give you specifics about why this is a big movement if you 're not aware of it one point two million americans have gotten a nike shoe ,string,,_ t h a t _ ' s _ w h e r e _ t h i s _ i s _ a l l _ s t a r t i n g _ _ l e t _ m e _ j u s t _ g i v e _ y o u _ s p e c i f i c s _ a b o u t _ w h y _ t h i s _ i s _ a _ b i g _ m o v e m e n t _ i f _ y o u _ ' r e _ n o t _ a w a r e _ o f _ i t _ o n e _ p o i n t _ t w o _ m i l l i o n _ a m e r i c a n s _ h a v e _ g o t t e n _ a _ n i k e _ s h o e _,string,
127,213304,EricTopol_2009P_930.52_939.91,9.39,930.52,939.91,./ressources/audio/TEDLIUM_release-3/legacy/train/sph/EricTopol_2009P.sph,sph,,EricTopol_2009P,string,,and when you put that together with for example now an app for the iphone with your genotype to guide drug therapy  but the future,string,,a n d _ w h e n _ y o u _ p u t _ t h a t _ t o g e t h e r _ w i t h _ f o r _ e x a m p l e _ n o w _ a n _ a p p _ f o r _ t h e _ i p h o n e _ w i t h _ y o u r _ g e n o t y p e _ t o _ g u i d e _ d r u g _ t h e r a p y _ _ b u t _ t h e _ f u t u r e,string,
4,213181,EricTopol_2009P_38.14_46.12,7.98,38.14,46.12,./ressources/audio/TEDLIUM_release-3/legacy/train/sph/EricTopol_2009P.sph,sph,,EricTopol_2009P,string,,wireless devices  ok  so let me give you some examples of this to kind of make this much more concrete  this is the first one ,string,,w i r e l e s s _ d e v i c e s _ _ o k _ _ s o _ l e t _ m e _ g i v e _ y o u _ s o m e _ e x a m p l e s _ o f _ t h i s _ t o _ k i n d _ o f _ m a k e _ t h i s _ m u c h _ m o r e _ c o n c r e t e _ _ t h i s _ i s _ t h e _ f i r s t _ o n e _,string,
123,213300,EricTopol_2009P_897.39_903.32,5.93,897.39,903.32,./ressources/audio/TEDLIUM_release-3/legacy/train/sph/EricTopol_2009P.sph,sph,,EricTopol_2009P,string,, thing besides having this fantastic institute to catalyze this process is guidance,string,,_ t h i n g _ b e s i d e s _ h a v i n g _ t h i s _ f a n t a s t i c _ i n s t i t u t e _ t o _ c a t a l y z e _ t h i s _ p r o c e s s _ i s _ g u i d a n c e,string,
65,213242,EricTopol_2009P_475.43_478.14,2.71,475.43,478.14,./ressources/audio/TEDLIUM_release-3/legacy/train/sph/EricTopol_2009P.sph,sph,,EricTopol_2009P,string,, course it tells you how many calories you 're expending,string,,_ c o u r s e _ i t _ t e l l s _ y o u _ h o w _ m a n y _ c a l o r i e s _ y o u _ ' r e _ e x p e n d i n g,string,
63,213240,EricTopol_2009P_456.43_467.75,11.32,456.43,467.75,./ressources/audio/TEDLIUM_release-3/legacy/train/sph/EricTopol_2009P.sph,sph,,EricTopol_2009P,string,,but this monitors food it monitors activity and tracks weight however you have to put in most of this stuff the only thing it really tracks by itself is activity and even then it 's not complete ,string,,b u t _ t h i s _ m o n i t o r s _ f o o d _ i t _ m o n i t o r s _ a c t i v i t y _ a n d _ t r a c k s _ w e i g h t _ h o w e v e r _ y o u _ h a v e _ t o _ p u t _ i n _ m o s t _ o f _ t h i s _ s t u f f _ t h e _ o n l y _ t h i n g _ i t _ r e a l l y _ t r a c k s _ b y _ i t s e l f _ i s _ a c t i v i t y _ a n d _ e v e n _ t h e n _ i t _ ' s _ n o t _ c o m p l e t e _,string,
97,213274,EricTopol_2009P_668.13_676.96,8.83,668.13,676.96,./ressources/audio/TEDLIUM_release-3/legacy/train/sph/EricTopol_2009P.sph,sph,,EricTopol_2009P,string,,that is for men twenty nine percent in the country over sixty have type ii diabetes and women although it 's less it 's terribly high,string,,t h a t _ i s _ f o r _ m e n _ t w e n t y _ n i n e _ p e r c e n t _ i n _ t h e _ c o u n t r y _ o v e r _ s i x t y _ h a v e _ t y p e _ i i _ d i a b e t e s _ a n d _ w o m e n _ a l t h o u g h _ i t _ ' s _ l e s s _ i t _ ' s _ t e r r i b l y _ h i g h,string,
23,213200,EricTopol_2009P_179.99_184.07,4.08,179.99,184.07,./ressources/audio/TEDLIUM_release-3/legacy/train/sph/EricTopol_2009P.sph,sph,,EricTopol_2009P,string,, because now  introduced by g e is a handheld ultra sound,string,,_ b e c a u s e _ n o w _ _ i n t r o d u c e d _ b y _ g _ e _ i s _ a _ h a n d h e l d _ u l t r a _ s o u n d,string,
67,213244,EricTopol_2009P_485.36_486.84,1.48,485.36,486.84,./ressources/audio/TEDLIUM_release-3/legacy/train/sph/EricTopol_2009P.sph,sph,,EricTopol_2009P,string,,i went to this,string,,i _ w e n t _ t o _ t h i s,string,
28,213205,EricTopol_2009P_204.9_207.01,2.11,204.9,207.01,./ressources/audio/TEDLIUM_release-3/legacy/train/sph/EricTopol_2009P.sph,sph,,EricTopol_2009P,string,, but also all the imaging,string,,_ b u t _ a l s o _ a l l _ t h e _ i m a g i n g,string,
109,213286,EricTopol_2009P_776.63_786.85,10.22,776.63,786.85,./ressources/audio/TEDLIUM_release-3/legacy/train/sph/EricTopol_2009P.sph,sph,,EricTopol_2009P,string,, the problem is enormous  three hundred thousand broken hips per year  but the solutions are extraordinary and they include so many different things one of the ones i just wanted to mention ,string,,_ t h e _ p r o b l e m _ i s _ e n o r m o u s _ _ t h r e e _ h u n d r e d _ t h o u s a n d _ b r o k e n _ h i p s _ p e r _ y e a r _ _ b u t _ t h e _ s o l u t i o n s _ a r e _ e x t r a o r d i n a r y _ a n d _ t h e y _ i n c l u d e _ s o _ m a n y _ d i f f e r e n t _ t h i n g s _ o n e _ o f _ t h e _ o n e s _ i _ j u s t _ w a n t e d _ t o _ m e n t i o n _,string,
