,Unnamed: 0,index,ID,duration,start_seg,end_seg,wav,wav_format,wav_opts,spk_id,spk_id_format,spk_id_opts,wrd,wrd_format,wrd_opts,char,char_format,char_opts
96,109,87737,JamesBeacham_2016X_732.45_739.57,7.12,732.45,739.57,/local_disk/idyie/tnguyen/TEDLIUM_release-3/legacy/train/sph/JamesBeacham_2016X.sph,sph,,JamesBeacham_2016X,string,,but why not i mean if i didn 't discover a particle and i didn 't,string,,b u t _ w h y _ n o t _ i _ m e a n _ i f _ i _ d i d n _ ' t _ d i s c o v e r _ a _ p a r t i c l e _ a n d _ i _ d i d n _ ' t,string,
98,121,87749,JamesBeacham_2016X_810.57_817.15,6.58,810.57,817.15,/local_disk/idyie/tnguyen/TEDLIUM_release-3/legacy/train/sph/JamesBeacham_2016X.sph,sph,,JamesBeacham_2016X,string,, big  obvious to spot bumps or they can only reveal themselves after years of data taking,string,,_ b i g _ _ o b v i o u s _ t o _ s p o t _ b u m p s _ o r _ t h e y _ c a n _ o n l y _ r e v e a l _ t h e m s e l v e s _ a f t e r _ y e a r s _ o f _ d a t a _ t a k i n g,string,
99,42,87670,JamesBeacham_2016X_279.69_282.68,2.99,279.69,282.68,/local_disk/idyie/tnguyen/TEDLIUM_release-3/legacy/train/sph/JamesBeacham_2016X.sph,sph,,JamesBeacham_2016X,string,, celebration this was a milestone,string,,_ c e l e b r a t i o n _ t h i s _ w a s _ a _ m i l e s t o n e,string,
100,111,87739,JamesBeacham_2016X_745.17_746.48,1.31,745.17,746.48,/local_disk/idyie/tnguyen/TEDLIUM_release-3/legacy/train/sph/JamesBeacham_2016X.sph,sph,,JamesBeacham_2016X,string,,and go home,string,,a n d _ g o _ h o m e,string,
101,70,87698,JamesBeacham_2016X_442.89_452.93,10.04,442.89,452.93,/local_disk/idyie/tnguyen/TEDLIUM_release-3/legacy/train/sph/JamesBeacham_2016X.sph,sph,,JamesBeacham_2016X,string,, they 're very expensive  events where only two photons hit out detector are very rare  and because of the special quantum properties of photons,string,,_ t h e y _ ' r e _ v e r y _ e x p e n s i v e _ _ e v e n t s _ w h e r e _ o n l y _ t w o _ p h o t o n s _ h i t _ o u t _ d e t e c t o r _ a r e _ v e r y _ r a r e _ _ a n d _ b e c a u s e _ o f _ t h e _ s p e c i a l _ q u a n t u m _ p r o p e r t i e s _ o f _ p h o t o n s,string,
103,62,87690,JamesBeacham_2016X_397.03_404.97,7.94,397.03,404.97,/local_disk/idyie/tnguyen/TEDLIUM_release-3/legacy/train/sph/JamesBeacham_2016X.sph,sph,,JamesBeacham_2016X,string,,this little bump was unique this little bump indicated that we were seeing an unexpectedly large number of collisions whose debris,string,,t h i s _ l i t t l e _ b u m p _ w a s _ u n i q u e _ t h i s _ l i t t l e _ b u m p _ i n d i c a t e d _ t h a t _ w e _ w e r e _ s e e i n g _ a n _ u n e x p e c t e d l y _ l a r g e _ n u m b e r _ o f _ c o l l i s i o n s _ w h o s e _ d e b r i s,string,
106,72,87700,JamesBeacham_2016X_461.23_465.92,4.69,461.23,465.92,/local_disk/idyie/tnguyen/TEDLIUM_release-3/legacy/train/sph/JamesBeacham_2016X.sph,sph,,JamesBeacham_2016X,string,,but one of these options is huge  and it has to do with that ,string,,b u t _ o n e _ o f _ t h e s e _ o p t i o n s _ i s _ h u g e _ _ a n d _ i t _ h a s _ t o _ d o _ w i t h _ t h a t _,string,
